<?xml version="1.0" encoding="UTF-8"?>
<test_data xmlns:xsi="http://www.w3.org/2001/XMLSchema-instance"
	xsi:noNamespaceSchemaLocation="constraint_up_to_count.xsd">
	<!-- Count: 0 -->
	<data valid="true">
		<count>0</count>
		<valid>0</valid>
	</data>
	<data valid="false">
		<count>0</count>
		<valid>1</valid>
	</data>
	<data valid="false">
		<count>0</count>
		<valid>3</valid>
	</data>
	<data valid="false">
		<count>0</count>
		<valid>3</valid>
	</data>
	<!-- Count: 1 -->
	<data valid="true">
		<count>1</count>
		<valid>0</valid>
	</data>
	<data valid="true">
		<count>1</count>
		<valid>1</valid>
	</data>
	<data valid="false">
		<count>1</count>
		<valid>2</valid>
	</data>
	<data valid="false">
		<count>1</count>
		<valid>3</valid>
	</data>
	<!-- Count: 5 -->
	<data valid="true">
		<count>5</count>
		<valid>0</valid>
	</data>
	<data valid="true">
		<count>5</count>
		<valid>1</valid>
	</data>
	<data valid="true">
		<count>5</count>
		<valid>2</valid>
	</data>
	<data valid="true">
		<count>5</count>
		<valid>3</valid>
	</data>
	<data valid="true">
		<count>5</count>
		<valid>4</valid>
	</data>
	<data valid="true">
		<count>5</count>
		<valid>5</valid>
	</data>
	<data valid="false">
		<count>5</count>
		<valid>6</valid>
	</data>
	<data valid="false">
		<count>5</count>
		<valid>10</valid>
	</data>
	<!-- Count: 10 -->
	<data valid="true">
		<count>10</count>
		<valid>0</valid>
	</data>
	<data valid="true">
		<count>10</count>
		<valid>1</valid>
	</data>
	<data valid="true">
		<count>10</count>
		<valid>2</valid>
	</data>
	<data valid="true">
		<count>10</count>
		<valid>10</valid>
	</data>
	<data valid="false">
		<count>10</count>
		<valid>11</valid>
	</data>
	<data valid="false">
		<count>10</count>
		<valid>100</valid>
	</data>
	<!-- Count: MAX -->
	<data valid="true">
		<count>2147483647</count>
		<valid>0</valid>
	</data>
	<data valid="true">
		<count>2147483647</count>
		<valid>1</valid>
	</data>
	<data valid="true">
		<count>2147483647</count>
		<valid>10</valid>
	</data>
	<data valid="true">
		<count>2147483647</count>
		<valid>100</valid>
	</data>
</test_data>